{
  "v": 1,
  "messageId": "5a0c1d2e-3f40-4152-8a6b-7c8d9e0f1a2d",
  "organizationId": 1,
  "sourceId": 3,
  "sourceType": "SIMULATION",
  "topic": "application/6a1c5b0e-0000-4000-8000-000000000001/device/24e124743d012436/event/up",
  "payload": "eyJkZWR1cGxpY2F0aW9uSWQiOiIzZjFlOWIyYS0wYzRkLTRlNWYtOGE2Yi03YzhkOWUwZjFhMmIiLCJ0aW1lIjoiMjAyNi0xMC0wM1QwMjo0MDowOS4xMjMrMDA6MDAiLCJkZXZpY2VJbmZvIjp7ImFwcGxpY2F0aW9uSWQiOiI2YTFjNWIwZS0wMDAwLTQwMDAtODAwMC0wMDAwMDAwMDAwMDEiLCJkZXZpY2VOYW1lIjoiV1MzMDItMDEyNDM2IiwiZGV2RXVpIjoiMjRlMTI0NzQzZDAxMjQzNiIsInRhZ3MiOnsibG9jYXRpb24iOiLsi6TsirXsi6QiLCJwb2ludCI6IuqwleuLqCIsInNwb3QiOiLqsJXri6gifX0sImRldkFkZHIiOiIwMTljNDg2MyIsImZDbnQiOjIzNTE4LCJmUG9ydCI6ODUsImRhdGEiOiJBWFUzQlZzQnBBRXhBYVFCIiwib2JqZWN0Ijp7ImJhdHRlcnkiOjU1LjAsIkxBZXEiOjMwLjUsIkxBSSI6NDIuMCwiTEFJbWF4Ijo0Mi4wfSwicnhJbmZvIjpbeyJnYXRld2F5SWQiOiIyNGUxMjRmZmZlZjc5MzA0IiwicnNzaSI6LTMzLCJzbnIiOjEzLjUsIm5zVGltZSI6IjIwMjYtMTAtMDNUMDI6NDA6MDkuMTQwWiJ9LHsiZ2F0ZXdheUlkIjoiMjRlMTI0ZmZmZWY1ZGNjYyIsInJzc2kiOi0xMDcsInNuciI6LTIuMCwibnNUaW1lIjoiMjAyNi0xMC0wM1QwMjo0MDowOS4xNTJaIn1dfQ==",
  "receivedAt": "2026-10-03T02:40:09.501Z",
  "ingressInstance": "data2flow-ingress-0",
  "dedupKey": "sha256:1111111111111111111111111111111111111111111111111111111111111111",
  "virtual": true,
  "simRunId": 77
}